"","Start_time","Stop_time","Query","Query_complexity","Role","Sub_themes","Code","Query_counter","Transcript","Actor_pair"
"409","00:04:51.920","00:05:05.540","Outsource job India","understand","Intermediary","Results Presentation","B:SERP without modification",14,"So we have five jobs being outsourced, we have ten popular jobs to outsource, jobs job outsourcing to India benefits, what to outsource to India","5"
"410","00:05:06.820","00:05:09.480","Outsource job India","understand","Seeker","Discourse Management","A:Asks to repeat first search result",15,"Uhm could you repeat the first one again?","5"
"411","00:05:09.680","00:05:12.720","Outsource job India","understand","Intermediary","Discourse Management","B:Repeats",16,"Five jobs being outsourced","5"
"412","00:05:14.340","00:05:19.520","Outsource job India","understand","Seeker","Navigation","A:Access source",17,"OK can you take a look at that and let me know what it says?","5"
"413","00:05:36.540","00:06:02.140","Outsource job India","understand","Intermediary","Results Presentation","B:Scanning document without modification",18,"So it says it lists five jobs that being outsourced to India like nursing, call centres, research and development, manufacturing... uhm business process outsourcing so these are the five that they are mentioning","5"
"414","00:06:04.920","00:06:07.920","Outsource job India","understand","Seeker","Discourse Management","A:Asks to repeat",19,"And the last one was business process?","5"
"415","00:06:08.100","00:06:09.980","Outsource job India","understand","Intermediary","Discourse Management","B:Repeats",20,"Business process outsourcing","5"
"416","00:06:20.760","00:06:28.340","Outsource job India","understand","Seeker","Discourse Management","A:Asks to repeat",21,"So you have nursing, call centres, RND, manufacturing, and business process outsourcing?","5"
"417","00:06:28.460","00:06:28.960","Outsource job India","understand","Intermediary","Discourse Management","B:Confirms",22,"Yeah","5"
"418","00:06:29.600","00:06:42.820","Outsource job India","understand","Seeker","Information Request","A:Information request within document",23,"Uhm and is this list specific uhm specific to the US or uhm is is just in general what kind of jobs are being sent to India?","5"
"419","00:06:52.540","00:07:19.120","Outsource job India","understand","Intermediary","Results Presentation + Results Presentation","B:Within-Document search result + SERP without modification",24,"Well it specifically says that it is from the US but not specifically for India, so the title was five jobs being outsourced [long pause] so we still have the link what to outsource to India","5"
"420","00:07:21.420","00:07:25.460","Outsource job India","understand","Seeker","Navigation","A:Access source",25,"OK uhm... let's take a look at that","5"
"421","00:07:55.520","00:08:25.920","Outsource job India","understand","Intermediary","Results Presentation","B:Scanning document without modification",26,"OK, so it's specifically for India and it's like uhm a source an outsourcing provider called outsource two India and it's specifies some uhm services that can be outsourced to India like call centres, data entry services, transcription services, engineering services, healthcare, finance, software development, photo editing, and web analytics","5"
"422","00:08:31.520","00:08:51.880","Outsource job India","understand","Seeker","Search Progression + Information Request","A:Performance feedback + Info about document",27,"OK uhm [long pause] that's pretty good uhm do you know uhm do you know where the uhm website was written, is it written by an American person or","5"
"423","00:09:01.200","00:09:12.440","Outsource job India","understand","Intermediary","Results Presentation","B:Source information",28,"The the website itself is the one who's uhm providing the service which is called outsource to India dot com","5"
"424","00:09:32.560","00:09:42.200","Outsource job India","understand","Seeker","Information Request","A:Intent clarification",29,"Because the thing I wanna know is what kind of jobs that used to be done in the US are now being sent over to India","5"
"425","00:09:44.160","00:09:56.560","Outsource job India","understand","Intermediary","Information Request","B:Query refinement offer",30,"So you would like to know what type of jobs... has transferred to being outsourced","5"
"426","00:10:02.840","00:10:05.320","Outsource job India","understand","Seeker","Information Request","A:Intent clarification",31,"Yes from uhm from the US to India","5"
"427","00:10:16.200","00:10:22.200","What language do they speak in New Caledonia?","remember","Seeker","Information Request","A:Initial information request",1,"Can you search for language plus New Caledonia","5"
"428","00:10:22.780","00:10:23.480","What language do they speak in New Caledonia?","remember","Intermediary","Discourse Management","B:Asks to repeat",2,"New","5"
"429","00:10:23.920","00:10:26.260","What language do they speak in New Caledonia?","remember","Seeker","Information Request","A:Query embellishment",3,"New Caledonia the country","5"
"430","00:10:35.230","00:10:40.770","What language do they speak in New Caledonia?","remember","Intermediary","Information Request + Results Presentation","B:Query rephrase + SERP Card",4,"So I you want to know the official language of Caledonia... It's French","5"
"431","00:10:44.090","00:10:48.540","What language do they speak in New Caledonia?","remember","Seeker","Information Request","A:Information request",5,"Is that are there any other spoken languages that are not official?","5"
"432","00:10:53.520","00:10:55.980","What language do they speak in New Caledonia?","remember","Intermediary","Results Presentation","B:SERP without modification",6,"So we have a link to Wikipedia","5"
"433","00:10:57.590","00:10:58.140","What language do they speak in New Caledonia?","remember","Seeker","Discourse Management","A:Confirms",7,"OK","5"
"434","00:10:59.930","00:11:19.880","What language do they speak in New Caledonia?","remember","Intermediary","Results Presentation + Information Request","B:Scanning document without modification + Enquiry for further information",8,"I'll follow that [long pause] so it says they have native languages they have French language and they have languages from immigrant populations so would you like to know more","5"
"435","00:11:24.730","00:11:29.170","What language do they speak in New Caledonia?","remember","Seeker","Discourse Management","A:Asks to repeat",9,"So native languages... French and","5"
"436","00:11:30.700","00:11:32.970","What language do they speak in New Caledonia?","remember","Intermediary","Discourse Management","B:Repeats",10,"Some other languages from immigrants","5"
"437","00:11:36.750","00:11:42.880","What language do they speak in New Caledonia?","remember","Seeker","Information Request","A:Information request within document",11,"Does it have uhm how how much of the population speaks French?","5"
"438","00:12:10.240","00:12:12.040","What language do they speak in New Caledonia?","remember","Intermediary","Results Presentation","B:Within-Document search result",12,"So it says whites or Europeans from New Caledonia speak French","5"
"439","00:12:20.540","00:12:32.450","Airport Security","analyze","Seeker","Information Request","A:Initial information request",1,"Can you search for airport security... plus uhm... success","5"
"440","00:12:36.590","00:12:37.670","Airport Security","analyze","Intermediary","Information Request","B:Query refinement offer",2,"In a certain place?","5"
"441","00:12:39.180","00:12:40.620","Airport Security","analyze","Seeker","Information Request","A:Intent clarification",3,"Uhm no in general","5"
"442","00:12:51.121","00:13:20.880","Airport Security","analyze","Intermediary","Results Presentation + Information Request","B:SERP without modification + Query refinement offer",4,"So we have links like new airport security screening method more successful, other stuff like airport security astoundingly expensive and ninety-five percent ineffective... uhm what Israeli airport security can teach the world, so you're looking for percent of success or places of success or?","5"
"443","00:13:22.800","00:13:40.120","Airport Security","analyze","Seeker","Information Request","A:Intent clarification",5,"Uhm I wanna know how effective uhm... I wanna know how effective uhm airport security measures are especially the newer airport security measures","5"
"444","00:13:40.220","00:13:50.760","Airport Security","analyze","Intermediary","Results Presentation + Discourse Management","B:SERP without modification + Checks navigational command",6,"We have a link to it says airport security security astoundingly expensive and ninety-five percent ineffective would you like to check that?","5"
"445","00:13:51.140","00:13:52.520","Airport Security","analyze","Seeker","Discourse Management","A:Confirms",7,"Uhm OK","5"
"446","00:14:21.640","00:14:58.840","Airport Security","analyze","Intermediary","Results Presentation","B:Scanning document without modification",8,"So it it just lists some of the bad measures of airport security things like screening they are not worth the cost even in the best circumstances, has given uhm, some examples about some, security uhm issues like the Al-Qaeda... uhm... bombing like the nine eleven stuff like that","5"
"447","00:15:06.520","00:15:08.320","Airport Security","analyze","Seeker","Navigation","A:Is there more information",9,"Is that it?","5"
"448","00:15:09.100","00:15:30.800","Airport Security","analyze","Intermediary","Results Presentation + Information Request","B:Scanning document with modification + Query refinement offer",10,"I, it's just despite that, it's not worth it, it is expensive but it doesn't work, still issues can occur like bombing or... would you like to enhance this search by effectiveness of methods maybe?","5"
"449","00:15:32.560","00:15:35.320","Airport Security","analyze","Seeker","Discourse Management","A:Confirms",11,"Uhm... OK let's try that","5"
"450","00:15:48.500","00:16:15.380","Airport Security","analyze","Intermediary","Results Presentation + Information Request","B:SERP without modification + Query refinement offer",12,"So we have results like does airport security really make you us safe uhm, airport security what's wrong with it, so would you like to know like, the effectiveness then in terms of... which methods are effective or, why is it not safe or?","5"
"451","00:16:16.600","00:16:57.360","Airport Security","analyze","Seeker","Grounding + Information Request","A:Interpretation + Information Request",13,"Uhm... I wanna find out how uhm... effective the security measures are at screening dangerous passengers and sort of dangerous items and baggage uhm but it seems like most of the results are saying that it's not effective uhm so, I kinda wanna know... why those I kinda wanna know what is not effective and why it's not effective","5"
"452","00:18:25.780","00:18:42.080","Airport Security","analyze","Intermediary","Results Presentation","B:SERP without modification",14,"So we have links like why airport security is broken and how to fix it, we have links like airport security and TSA what's wrong with it, links like airport security is unnecessary and ineffective","5"
"453","00:18:51.960","00:19:06.600","Airport Security","analyze","Seeker","Navigation + Information Request","A:Access source + Information request within document",15,"Uhm can you go into the first link and see if there is any information on... secondary measures... so secondary screening measures","5"
"454","00:19:07.080","00:19:12.120","Airport Security","analyze","Intermediary","Discourse Management","B:Checks navigational command",16,"So the first link why airport security is broken and how to fix it","5"
"455","00:19:12.560","00:19:13.340","Airport Security","analyze","Seeker","Discourse Management","A:Confirms",17,"Yes","5"
"456","00:21:26.340","00:21:28.100","Airport Security","analyze","Intermediary","Search Assistance","B:Relevance judgement",18,"It doesn't seem to be helpful","5"
"457","00:21:30.040","00:21:30.800","Airport Security","analyze","Seeker","Discourse Management","A:Asks to repeat",19,"Sorry?","5"
"458","00:21:31.120","00:21:32.600","Airport Security","analyze","Intermediary","Search Assistance","B:Relevance judgement",20,"It doesn't seem to be helpful","5"
"459","00:21:37.940","00:21:44.100","Airport Security","analyze","Seeker","Information Request","A:Info about document",21,"Does it say uhm is is that like a website or an article or something?","5"
"460","00:21:44.100","00:21:46.340","Airport Security","analyze","Intermediary","Results Presentation","B:Source information",22,"It's an article at the Wall Street Journal","5"
"461","00:21:49.280","00:21:52.740","Airport Security","analyze","Seeker","Information Request","A:Information request within document",23,"Does it say why it thinks airport security is broken?","5"
"462","00:21:55.283","00:22:01.100","Airport Security","analyze","Intermediary","Results Presentation","B:Scanning document with modification",24,"So they're trying to make uhm an analysis of nine eleven","5"
"463","00:22:01.740","00:22:02.600","Airport Security","analyze","Seeker","Discourse Management","A:Confirms",25,"OK","5"
"464","00:22:22.960","00:22:25.000","Airport Security","analyze","Intermediary","Results Presentation","B:Scanning document with modification",26,"They're trying to... define the rule for the TSA and how to make airports safe","5"
"465","00:00:07.120","00:00:15.240","Airport Security","analyze","Seeker","Information Request","A:Initial information request",1,"Effectiveness of security measures at airports","6"
"466","00:00:24.415","00:00:27.000","Airport Security","analyze","Intermediary","Discourse Management","B:Asks to repeat",2,"So it's effective measures","6"
"467","00:00:27.000","00:00:30.025","Airport Security","analyze","Seeker","Information Request","A:Query embellishment",3,"Effectiveness","6"
"468","00:00:30.780","00:00:32.118","Airport Security","analyze","Intermediary","Discourse Management","B:Asks to repeat",4,"Security","6"
"469","00:00:32.208","00:00:36.949","Airport Security","analyze","Seeker","Information Request","A:Query embellishment",5,"Security measures new security measures at airports","6"
"470","00:00:47.623","00:01:06.428","Airport Security","analyze","Intermediary","Results Presentation + Search Assistance","B:SERP without modification + Asking about usefulness",6,"So the first result that comes up for effectiveness of of new new security measures at airports is, airport security measures aren't good enough here's a fix is that what you're looking for?","6"
"471","00:01:07.350","00:01:10.766","Airport Security","analyze","Seeker","Discourse Management","A:Asks to repeat",7,"Uhm, here's a fix does it say?","6"
"472","00:01:11.353","00:01:11.768","Airport Security","analyze","Intermediary","Discourse Management","B:Confirms",8,"Yep","6"
"473","00:01:12.431","00:01:12.937","Airport Security","analyze","Seeker","Discourse Management","A:Confirms",9,"Hmmm","6"
"474","00:01:13.636","00:01:24.519","Airport Security","analyze","Intermediary","Results Presentation","B:SERP without modification",10,"Uhm next one search item that comes up says does airport security really make us safer, that's an article by Vanity Fair","6"
"475","00:01:25.240","00:01:30.800","Airport Security","analyze","Seeker","Navigation","A:Access source",11,"OK uhm yeah that sounds quite interesting uhm would have a look at that","6"
"476","00:01:31.506","00:01:33.272","Airport Security","analyze","Intermediary","Discourse Management","B:Checks navigational command",12,"The Vanity Fair article?","6"
"477","00:01:33.390","00:01:33.792","Airport Security","analyze","Seeker","Discourse Management","A:Confirms",13,"Yeah","6"
"478","00:01:41.101","00:01:44.374","Airport Security","analyze","Intermediary","Results Presentation","B:Scanning document without modification",14,"So so this article","6"
"479","00:01:46.974","00:01:50.051","Airport Security","analyze","Seeker","Information Request","A:Information request within document",15,"Does it have headings in it... that can","6"
"480","00:01:50.311","00:02:11.649","Airport Security","analyze","Intermediary","Results Presentation + Information Request","B:Scanning document with modification + Enquiry for further information",16,"Yeah, so it's under the category of travel and then the title of the article is called smoke screening yeah it was written in two thousand and eleven [long pause] would you like to the first paragraph?","6"
"481","00:02:12.360","00:02:14.480","Airport Security","analyze","Seeker","Information Request","A:Information request within document",17,"Yeah does it have subheadings in it?","6"
"482","00:02:15.272","00:02:26.051","Airport Security","analyze","Intermediary","Results Presentation + Information Request","B:Scanning document without modification + Enquiry for further information",18,"Uhm yeah subheading, I can read what is underneath the smoke screening","6"
"483","00:02:26.192","00:02:26.828","Airport Security","analyze","Seeker","Discourse Management","A:Confirms",19,"OK","6"
"484","00:02:27.300","00:02:50.040","Airport Security","analyze","Intermediary","Results Presentation","B:Scanning document without modification",20,"It says uhm as you stand in endless lines this holiday season, here's a comforting thought, all those security measures accomplish nothing, at enormous cast. That's the conclusion of Charles C Mann, who put the TSA to the test with the help of one of Australia uhm America's top security experts","6"
"485","00:03:02.027","00:03:05.040","Airport Security","analyze","Seeker","Information Request","A:Information request within document",21,"So what was the name of the guy who did the report sorry?","6"
"486","00:03:05.160","00:03:07.520","Airport Security","analyze","Intermediary","Results Presentation","B:Within-Document search result",22,"Yeah, so it's by Charles C Mann","6"
"487","00:03:07.840","00:03:14.920","Airport Security","analyze","Seeker","Discourse Management + Information Request","A:Confirms + Information Request",23,"Charles C Mann so I'm wondering if we could uhm search him and his report to see what that tells us","6"
"488","00:03:37.880","00:03:43.135","Airport Security","analyze","Intermediary","Information Request","B:Query refinement offer",24,"So of the report on airport security","6"
"489","00:03:43.709","00:03:44.601","Airport Security","analyze","Seeker","Discourse Management","A:Confirms",25,"Yeah","6"
"490","00:04:13.662","00:04:26.175","Airport Security","analyze","Intermediary","Results Presentation + Information Request","B:SERP with modification + Requests more details about information request",26,"I don't think he wrote... did he write did Charles write the report or are you referring to an article a report he is referring to","6"
"491","00:04:27.986","00:04:37.560","Airport Security","analyze","Seeker","Information Request","A:Information request within document",27,"Uhm did it say the report was written by Charles Mann was it, the TSA?","6"
"492","00:04:51.760","00:04:54.800","Airport Security","analyze","Intermediary","Information Request","B:Requests more details about information request",28,"Did you say the article or the report?","6"
"493","00:04:56.243","00:05:12.840","Airport Security","analyze","Seeker","Information Request","A:Intent clarification",29,"Uhm I was wondering if you could search for the report that he'd written... that they mentioned in the article because in the article don't they mention that the security measures that they are pretty much useless according to this guy in this report","6"
"494","00:05:14.824","00:05:16.840","Airport Security","analyze","Intermediary","Visibility Of System Status","B:Feedback on what is happening",30,"I'll have to read the article","6"
"495","00:05:45.800","00:05:49.130","Airport Security","analyze","Seeker","Visibility Of System Status","A:Access source feedback-request",31,"Uhm what's it, have you got the Vanity Fair article?","6"
"496","00:05:49.940","00:05:50.280","Airport Security","analyze","Intermediary","Discourse Management","B:Confirms",32,"Yes","6"
"497","00:05:50.300","00:05:54.660","Airport Security","analyze","Seeker","Discourse Management","A:Asks to repeat first search result",33,"Yeah so what was that first paragraph you were reading to me?","6"
"498","00:05:54.760","00:06:13.880","Airport Security","analyze","Intermediary","Results Presentation","B:Scanning document without modification",34,"As you stand in endless lines this holiday season, here's a comforting thought, all those security measures accomplish nothing, at enormous cost. That's the conclusion of Charles C Mann, who put the TSA to the test with the help of one of America's top security exports experts","6"
"499","00:06:14.378","00:06:18.000","Airport Security","analyze","Seeker","Information Request","A:Information request within document",35,"So is Charles C Mann the guy who wrote the Vanity Fair article?","6"
"500","00:06:18.160","00:06:18.635","Airport Security","analyze","Intermediary","Discourse Management","B:Confirms",36,"Yes","6"
"501","00:06:18.720","00:06:43.500","Airport Security","analyze","Seeker","Navigation","A:Read more from the document",37,"Oh he is, oh sorry that's what's confusing me then OK uhm hmmm. So I suppose [long pause] have they got any other if you could read me a bit more of the article that would be good","6"
"502","00:06:44.280","00:07:58.900","Airport Security","analyze","Intermediary","Results Presentation","B:Scanning document without modification",38,"OK starting the article... not until I worked walked with Bruce Schneider toward the mass of people unloading their laptops did it occur to me that it might not be possible for us to hang around unnoticed near reag reage Reagan National Airport's security line. Much as upscale restaurants hang mug shots of local food writers in their kitchens, I realised, the Transport Security Administration might post photographs of shnei Schneier, a forty-eight year old cryptographer and security technologist who is probably its most relentless critic. In addition to writing books sorry in addition to writing books and articles Schneier has a popular blog, a recent search for TSA in its archives elicited about two thousand results, the vast majority of which refer to some aspects of the agency that he finds to be ineffective, invasive, incompetent, inexcusably costly, or all four","6"
"503","00:07:59.280","00:08:29.340","Airport Security","analyze","Seeker","Discourse Management + Information Request","A:Confirms + Information Request",39,"Uhm OK uhm [long pause] this is a new search then if if you could for latest airport security measures","6"
"504","00:08:33.320","00:08:35.320","Airport Security","analyze","Intermediary","Discourse Management","B:Asks to repeat",40,"So new search is sorry?","6"
"505","00:08:35.300","00:08:38.940","Airport Security","analyze","Seeker","Discourse Management","A:Query repeat",41,"Yeah latest airport security measures","6"
"506","00:08:38.980","00:08:43.200","Airport Security","analyze","Intermediary","Discourse Management","B:Repeats the query back",42,"Latest airport security measures","6"
"507","00:08:43.260","00:08:47.300","Airport Security","analyze","Seeker","Information Request","A:Query embellishment",43,"Uhm effectiveness of sorry I should have said that","6"
"508","00:08:49.120","00:08:50.300","Airport Security","analyze","Intermediary","Discourse Management","B:Asks to repeat",44,"Sorry can you repeat that?","6"
"509","00:08:50.360","00:08:56.240","Airport Security","analyze","Seeker","Discourse Management","A:Query repeat",45,"Yeah effectiveness of latest airport security measures","6"
"510","00:08:58.120","00:09:07.940","Airport Security","analyze","Intermediary","Discourse Management + Visibility Of System Status","B:Repeats the query back + Previously seen results",46,"Effectiveness of latest airport security measures yeah cool... so the that Vanity Fair article is the first search","6"
"511","00:09:07.980","00:09:10.440","Airport Security","analyze","Seeker","Discourse Management","A:Confirms",47,"Is it really? OK","6"
"512","00:09:10.500","00:09:18.540","Airport Security","analyze","Intermediary","Results Presentation","B:SERP without modification",48,"The second one is airport security and TSA what's wrong with it by Fortune and that's a two thousand and fifteen article","6"
"513","00:09:18.980","00:09:22.020","Airport Security","analyze","Seeker","Navigation","A:Next",49,"OK yeah... and what's the third one?","6"
"514","00:09:22.260","00:09:32.040","Airport Security","analyze","Intermediary","Results Presentation","B:SERP without modification",50,"The third one is airport security colon as astoundingly expensive and ninety-five percent ineffective that article is also from two thousand and fifteen","6"
"515","00:09:32.800","00:09:38.100","Airport Security","analyze","Seeker","Navigation","A:Access source",51,"Uhm could we have a look at that third article please?","6"
"516","00:09:43.560","00:09:47.220","Airport Security","analyze","Intermediary","Results Presentation","B:Source information",52,"OK so it's from the Atlantic City lab","6"
"517","00:09:47.820","00:09:48.480","Airport Security","analyze","Seeker","Discourse Management","A:Confirms",53,"OK","6"
"518","00:09:51.760","00:09:53.700","Airport Security","analyze","Intermediary","Information Request","B:Enquiry for further information",54,"Would you like me to read the first?","6"
"519","00:09:54.080","00:09:56.300","Airport Security","analyze","Seeker","Discourse Management","A:Confirms",55,"Uhm yeah just the first paragraph","6"
